service_name,phone_number,hours_of_operation,description,source_url
Administrative Appeals Tribunal,1800 228 333,Hours of Operation: Business Hours,General enquiries,https://www.directory.gov.au/enquiry-lines/a#paginationControl
Aged Care Complaints,1800 550 552,Hours of Operation: Business Hours,Available to all users of aged care services,https://www.directory.gov.au/enquiry-lines/a#paginationControl
Aged Care Information Line,1800 200 422,Hours of Operation: Business hours,Information about Community Aged Care Packages and residential care fees in Australian Government funded facilities,https://www.directory.gov.au/enquiry-lines/a#paginationControl
Alcohol Campaign Information Line,1800 250 015,,Alcohol and Drug Information Service,https://www.directory.gov.au/enquiry-lines/a#paginationControl
ASIO - Australian Security Intelligence,1800 020 648,,,https://www.directory.gov.au/enquiry-lines/a#paginationControl
ATO entry point for government dept,(02) 6216 8600,,"If you require information from the ATO and are making an enquiry on behalf of a government department or agency, your request for assistance can be emailed to atogateway.gov.auThis service is only available in response to official requests from government departments and agencies (Federal State or Territory) - requests that do not come from a \2018.gov.au` or \2018.govt.nz` email address will be automatically rejected.Alternatively, you can call (02) 6216 8600 during business hours.This number is only available to government departments and agencies - for individual and business enquiries, refer to the numbers listed below - we cannot redirect your call or provide any individual or business assistance.",https://www.directory.gov.au/enquiry-lines/a#paginationControl
Austrade Export Inquiries,13 2878,Hours of Operation: Business Hours,,https://www.directory.gov.au/enquiry-lines/a#paginationControl
Australian Passport Assistance,131 232,Hours of Operation: Monday to Friday: 8.00 am to 7.00 pm (AEST).  We are closed on Australian national public holidays.,"Australian Passport Information Service (Telephone Service) Hours of operation:-You can call us on 131 232 Monday to Friday: 8.00 am to 7.00 pm (AEST)-You can submit your documents and forms at any Australian Passport Office. You must make an appointment before attending. Someone can attend on your behalf. Hours for appointments are 8:30am to 1pm, Monday to Friday.-Direct queries to: https://www.smartraveller.gov.au/consular-services/notarial-services/documents-in-australia-Authentications, Apostilles and Certificates of No Impediment - refer to the Legalising documents page for forms, costs and other important information. Documents lodged through the mail are processed in Sydney and Melbourne.-We can legalise your documents in Australia by mail or in person. To request our services, complete the Document legalisation request form. It's important that you prepare your documents and complete the request form accurately. We don't accept incomplete requests.Passport website:  www.passports.gov.auDue to Australian privacy laws information cannot be provided via an email request.",https://www.directory.gov.au/enquiry-lines/a#paginationControl
Australian Passport Information Service,13 1232,Hours of Operation: Monday to Friday: 8.00 am to 7.00 pm (AEST).  We are closed on Australian national public holidays.,"Australian Passport Information Service (Telephone Service) Hours of operation:-You can call us on 131 232 Monday to Friday: 8.00 am to 7.00 pm (AEST)-You can submit your documents and forms at any Australian Passport Office. You must make an appointment before attending. Someone can attend on your behalf. Hours for appointments are 8:30am to 1pm, Monday to Friday.-Direct queries to: https://www.smartraveller.gov.au/consular-services/notarial-services/documents-in-australia-Authentications, Apostilles and Certificates of No Impediment - refer to the Legalising documents page for forms, costs and other important information. Documents lodged through the mail are processed in Sydney and Melbourne.-We can legalise your documents in Australia by mail or in person. To request our services, complete the Document legalisation request form. It's important that you prepare your documents and complete the request form accurately. We don't accept incomplete requests.Passport website:  www.passports.gov.auDue to Australian privacy laws information cannot be provided via an email request.",https://www.directory.gov.au/enquiry-lines/a#paginationControl
Australian Passport Office,131 232,Hours of Operation: 8:30am to 4:00 pm weekdays,"For legalisation services, please make an appointment at  Australian Passport Office - Perth | Perth [ Book now ]",https://www.directory.gov.au/enquiry-lines/a#paginationControl
Australian Prudential Regulation Authori,1300 558 849,,APRA is the prudential regulator of financial institutions.,https://www.directory.gov.au/enquiry-lines/a#paginationControl
Australian Securities and Investments Co,1300 300 630,Hours of Operation: Business,General Enquiries,https://www.directory.gov.au/enquiry-lines/a#paginationControl
Aviation Search and Rescue,1800 815 257,Hours of Operation: 24 hour emergency,,https://www.directory.gov.au/enquiry-lines/a#paginationControl
Bankruptcy (personal) information,1300 364 785,Hours of Operation: Monday to Friday 8:30 am to 8:00 pm (AEST and AEDT),AFSA Bankruptcy (personal) information line.,https://www.directory.gov.au/enquiry-lines/b#paginationControl
Bereavement,1800 838 372,Hours of Operation: 8am to 5 pm,A bereavement payment is designed to help with the costs that may follow the death of a pensioner or a current or former serving member. The bereavement payment may depend on when the person who died was injured,https://www.directory.gov.au/enquiry-lines/b#paginationControl
Blood Authority Information line,(02) 6211 8300,Hours of Operation: Business Hours,General enquiries,https://www.directory.gov.au/enquiry-lines/b#paginationControl
Breastscreen Australia,13 2050,Hours of Operation: Business hours,To book a free screening mammogram,https://www.directory.gov.au/enquiry-lines/b#paginationControl
Business-hours Indigenous Helpline,13 1030,,"8am-6pm, Mon-Fri (local time) except national public holidays",https://www.directory.gov.au/enquiry-lines/b#paginationControl
Business-hours Non-profit organisations,1300 130 248,,"8am-6pm, Mon-Fri (local time) except national public holidays",https://www.directory.gov.au/enquiry-lines/b#paginationControl
Business-hours Superannuation Enquiries,13 1020,,"8am-6pm, Mon-Fri (local time) except national public holidays",https://www.directory.gov.au/enquiry-lines/b#paginationControl
Business-hours Translating and Interpret,13 1450,,"Translating and Interpreting service for people from non-English speaking backgrounds8am-6pm, Mon-Fri (local time) except national public holidays",https://www.directory.gov.au/enquiry-lines/b#paginationControl
business.gov.au 13 28 46,13 2846,Hours of Operation: 8.00am - 8.00pm AEST Monday to Friday,"business.gov.au is an online government resource for the Australian business community. business.gov.au offers you simple and convenient access to all of the government information, forms and services you need. It's a whole-of-government service providing essential information on planning, starting and growing your business.",https://www.directory.gov.au/enquiry-lines/b#paginationControl
Carer Resource Centres,1800 242 636,,Information and advice about services and assistance for carers,https://www.directory.gov.au/enquiry-lines/c#paginationControl
Cervical Screening Program,13 1556,,General information line,https://www.directory.gov.au/enquiry-lines/c#paginationControl
Citizenship Information Line,131 880,"Hours of Operation: Monday to Friday, 9am to 5pm",Use this number to:request application forms for Australian citizenshipobtain information about:application fees and processescitizenship ceremonies Australian citizenship affirmation ceremonies dual citizenship.,https://www.directory.gov.au/enquiry-lines/c#paginationControl
Commemorative Grants,1800 020 283,,"Enquiries regarding Saluting Their Service Grants Program which aims to preserve Australia’s wartime heritage and to involve people throughout the nation in a range of projects and activities that highlight the service and sacrifice of Australia’s service personnel in wars, conflicts and peace operations.",https://www.directory.gov.au/enquiry-lines/c#paginationControl
Community Nursing,1800 838 372,,Community Nursing,https://www.directory.gov.au/enquiry-lines/c#paginationControl
Competition and Consumer information - A,1300 302 502,Hours of Operation: 11am-3pm Monday to Friday,Information line to explain rights and obligations to business and consumers,https://www.directory.gov.au/enquiry-lines/c#paginationControl
"Complaints, compliments and suggestions",1800 199 010,,"We welcome your feedback - complaints, compliments and suggestions - about the services we provide and your experience with the way we deliver those services. This feedback helps us improve the way we do things.Call from overseas: +61 2 6216 1111",https://www.directory.gov.au/enquiry-lines/c#paginationControl
"Compliments, Complaints and Suggestions",133 177,Hours of Operation: 9am to 5pm (local Melbourne time),"​Your feedback is valuable to us. We use your feedback to improve our services to industry and the community, and investigate and respond to any issues of concern.Feedback can be compliments, complaints and suggestions:•Compliments are praise or congratulations about any aspect of our services, performance or how we do business.•Complaints are an expression of dissatisfaction or unmet expectations about any aspect of our service or the way we conduct our business.•Suggestions are ideas on how we could improve our services or do our business differently.We value your feedback. If we get things wrong, we need to address and evaluate such instances to resolve these matters promptly. Similarly, we should recognise when we are complimented on our service and performance.We are committed to providing services in ways that are considerate of the impact to:•Passenger movement•Cargo clearance•Compliance monitoring•Operational activities•Visa and Citizenship applications and processes•Service providers and partners.",https://www.directory.gov.au/enquiry-lines/c#paginationControl
Consular Emergency Centre,1300 555 135,,"The Consular Emergency Centre (CEC) provides emergency consular services 24 hours a day, seven days a week, around the world.",https://www.directory.gov.au/enquiry-lines/c#paginationControl
Continence Helpline,1800 330 066,Hours of Operation: Business hours,Assistance to improve continence treatment and management,https://www.directory.gov.au/enquiry-lines/c#paginationControl
Defence Service Home Insurance,1300 552 662,Hours of Operation: available 24/7 for emergency claim assistance,Comprehensive home building insurance cover tailored to the Defence community,https://www.directory.gov.au/enquiry-lines/d#paginationControl
Defence Service Home Lending,1800 722 000,,Housing loans to recognise the contribution of those who have served in the Australian Defence Force,https://www.directory.gov.au/enquiry-lines/d#paginationControl
Dementia Behaviour Advisory Service,1300 366 448,Hours of Operation: 24 Hours,This is a national telephone service to assist carers who look after those with dementia.,https://www.directory.gov.au/enquiry-lines/d#paginationControl
Dementia Helpline,1800 100 500,Hours of Operation: 24 Hours,The Dementia Helpline is a national support service staffed by trained and experienced advisors.,https://www.directory.gov.au/enquiry-lines/d#paginationControl
DVA Feedback,1800 838 372,Hours of Operation: 8am to 5 pm Monday to Friday,DVA Feedback,https://www.directory.gov.au/enquiry-lines/d#paginationControl
Employers' Immigration Hotline,1800 040 070,"Hours of Operation: Monday to Friday, 9am to 5pm","Use this number to check, as an employer, the work rights of potential employees.",https://www.directory.gov.au/enquiry-lines/e#paginationControl
Environment Community Information,1800 803 772,Hours of Operation: 9am to 4pm EST,For enquiries about the publications and services of the Department,https://www.directory.gov.au/enquiry-lines/e#paginationControl
Extended-hours Business,13 2866,,"8am-6pm, Mon-Fri and 10am-4pm, Sat (local time) except national public holidaysPlease note: A limited service will operate between 6pm and 8pm on weekdays and 10am and 4pm on Saturday",https://www.directory.gov.au/enquiry-lines/e#paginationControl
Extended-hours Debt Enquiries,13 1142,,"8am-6pm, Mon-Fri and 10am-4pm, Sat (local time) except national public holidaysPlease note: A limited service will operate between 6pm and 8pm on weekdays and 10am and 4pm on Saturday",https://www.directory.gov.au/enquiry-lines/e#paginationControl
Extended-hours Individuals,13 2861,,"8am-6pm, Mon-Fri and 10am-4pm, Sat and Sun (local time) except national public holidaysPlease note: A limited service for myGov/myTax enquiries will operate between 6pm and 10pm on weekdays and 10am and 4pm on weekends. Call 13 28 61 and select option 5",https://www.directory.gov.au/enquiry-lines/e#paginationControl
Extended-hours Registered Tax Profession,13 7286,,"8am-6pm, Mon-Fri and 10am-4pm, Sat (local time) except national public holidaysPlease note: A limited service will operate between 6pm and 8pm on weekdays and 10am and 4pm on Saturday",https://www.directory.gov.au/enquiry-lines/e#paginationControl
Fair Work Infoline,131 394,"Hours of Operation: 8.00am - 5.30pm local time, Monday to Friday",We're here to give advice and help you understand your workplace rights and responsibilities. If you have a question or problem relating to your workplace call the Fair Work Infoline.,https://www.directory.gov.au/enquiry-lines/f#paginationControl
Farm Support,1800 900 090,,For general enquiries,https://www.directory.gov.au/enquiry-lines/f#paginationControl
Freedom of Information Enquiries Line,1300 363 992,,The Office of the Australian Information Commissioner Enquiries Line covers FOI and Privacy enquiries,https://www.directory.gov.au/enquiry-lines/f#paginationControl
Gene Technology Regulator,1800 181 030,Hours of Operation: Business hours,General enquiries,https://www.directory.gov.au/enquiry-lines/g#paginationControl
General Enquiries,1300 488 064,,People with hearing or speech disability can use the National Relay Service to access the department`s phone numbers. Call 1300 555 727 (speak and listen) or go to the NRS website for other options.,https://www.directory.gov.au/enquiry-lines/g#paginationControl
General Enquiries,1800 838 372,Hours of Operation: 8am to 5 pm Monday to Friday,General inquiries (calls from within Australia),https://www.directory.gov.au/enquiry-lines/g#paginationControl
General Enquiries,1300 488 064,,People with hearing or speech disability can use the National Relay Service to access the department`s phone numbers. Call 1300 555 727 (speak and listen) or go to the NRS website for other options.,https://www.directory.gov.au/enquiry-lines/g#paginationControl
General Enquiries - International,+61 2 6289 1133,Hours of Operation: 8am to 5 pm Monday - Friday,General enquiries for international callers.,https://www.directory.gov.au/enquiry-lines/g#paginationControl
Hannah Massocchi,02 6272 5674,,Executive Assistant to People Strategy and Safety Branch,https://www.directory.gov.au/enquiry-lines/h#paginationControl
Health Care Cards,132 300,,Call Department of Human Services for information about eligibility and card types.,https://www.directory.gov.au/enquiry-lines/h#paginationControl
Health Care Complaints Commission,1800 043 159,,Complaints may be made about anything to do with public or private health care services or a health care practitioner,https://www.directory.gov.au/enquiry-lines/h#paginationControl
Health Grants - GrantNet,1800 500 983,Hours of Operation: Business hours,National Health and Medical Research Council grants information,https://www.directory.gov.au/enquiry-lines/h#paginationControl
Honours inquiries including nomination,02 6283 3604,Hours of Operation: 24 hours,Answering machine,https://www.directory.gov.au/enquiry-lines/h#paginationControl
Human Rights and Equal Opportunity Compl,1300 656 419,,"The Commission investigates alleged infringements of human rights under the Human Rights and Equal Opportunity Commission Act 1986 and breaches of anti-discrimination law under the Age Discrimination Act 2004, Disability Discrimination Act 1992, Racial Discrimination Act 1975 and Sex Discrimination Act 1984. Complaints are handled on a confidential basis with an emphasis on conciliation.",https://www.directory.gov.au/enquiry-lines/h#paginationControl
Immigration General Enquiries,131 881,Hours of Operation: Monday to Friday 9am to 5pm,"Note: This number is only available if you are calling from inside Australia. If you are outside Australia and wish to make an enquiry please contact the relevant Australian Immigration office overseas.Use this general enquiries number to:obtain general information on all temporary and permanent visa categories (including visitors, students, family migration, temporary business visas and refugee and humanitarian applications)make appointments for lodging visa applicationschange contact detailscontact departmental officers",https://www.directory.gov.au/enquiry-lines/i#paginationControl
Immunisation Hotline,1800 671 811,Hours of Operation: Business Hours,"o ATAGIo Australian Technical Advisory Group on Immunisationo Department of Health and Ageingo Health and Ageingo Immunisationo Immunise Australiao Immunisingo Inquirieso National Immunisation Committee (NIC) National Immunisation Program (NIP)o National Immunisation Program (NIP)o National Information Lineso Vaccinatingo Vaccinationo Vaccineo Vaccine preventableo Vaccine preventativeo Vaccine safetyAn Australian, State and Territory Government initiative, the Immunise Australia Program aims to increase national immunisation rates for vaccine preventable diseases. The Immunisation Hotline provides information on the National Immunisation Program and individual vaccines.",https://www.directory.gov.au/enquiry-lines/i#paginationControl
Instrument registration and gazettal Hel,(02) 6120 1350,,Instrument registration and gazettal Help desk,https://www.directory.gov.au/enquiry-lines/i#paginationControl
Maritime Search and Rescue,1800 641 792,Hours of Operation: 24 hours,,https://www.directory.gov.au/enquiry-lines/m#paginationControl
Media enquires - Agriculture,(61 2) 6272 3232,,For media enquiries about agriculture and biosecurity issues.,https://www.directory.gov.au/enquiry-lines/m#paginationControl
Media enquires - Environment,(61 2) 6275 9880,,For media enquiries about environment issues,https://www.directory.gov.au/enquiry-lines/m#paginationControl
Media Enquiries,02 6264 2244,Hours of Operation: 9am to 5pm,"The Department's Communication and Media Branch are responsible for media releases, responding to journalist, TV and photo enquiries, general media related enquiries and letters to editors in Australian newspapers on departmental issues.",https://www.directory.gov.au/enquiry-lines/m#paginationControl
Media Enquiries,(02) 6240 7300,,we will not respond to any other enquiry.,https://www.directory.gov.au/enquiry-lines/m#paginationControl
Medical Indemnity,1800 007 757,Hours of Operation: Business Hours,Information about medical indemnity insurance,https://www.directory.gov.au/enquiry-lines/m#paginationControl
Medicare,13 2011,Hours of Operation: Business Hours,General Enquiries,https://www.directory.gov.au/enquiry-lines/m#paginationControl
National Museum of Australia,1800 026 132,Hours of Operation: Business Hours,General Enquiries,https://www.directory.gov.au/enquiry-lines/n#paginationControl
National Security Hotline,1800 123 400,Hours of Operation: 24 hrs/day - 7 days/week,Report activities relevant to national security.,https://www.directory.gov.au/enquiry-lines/n#paginationControl
Nominal Rolls,1300 780 133,,A Nominal Roll is a list of the names of veterans who have served in a particular conflict in which Australia has participated.,https://www.directory.gov.au/enquiry-lines/n#paginationControl
Notifying Work-Related Incidents,1300 366 979,,Service for notifying work related incidents to Comcare.,https://www.directory.gov.au/enquiry-lines/n#paginationControl
Office of Australian War Graves,1800 838 372,Hours of Operation: 9am to 5.30pm Monday to Friday,Enquiries regarding war graves eligibility.,https://www.directory.gov.au/enquiry-lines/o#paginationControl
Oil spills & marine pollution,1800 641 792,Hours of Operation: 24 hours,Reporting polluting ships,https://www.directory.gov.au/enquiry-lines/o#paginationControl
Open Arms National,1800 011 046,Hours of Operation: 24 / 7,Open Arms Veterans and Families Counselling,https://www.directory.gov.au/enquiry-lines/o#paginationControl
Organ Donor Registry,1800 777 203,Hours of Operation: Business Hours,Information about registering to become an organ donor,https://www.directory.gov.au/enquiry-lines/o#paginationControl
Our Switchboard,13 2869,,"8am-5pm, Mon-Fri (local time) except national public holidays",https://www.directory.gov.au/enquiry-lines/o#paginationControl
Personal insolvency information,1300 364 785,Hours of Operation: Monday to Friday 8:30 am to 8:00 pm (AEST and AEDT),Designed for people who may be finding their level of debt unmanageable and are contemplating bankruptcy.,https://www.directory.gov.au/enquiry-lines/p#paginationControl
Personal Property Securities Register,1300 007 777,Hours of Operation: Monday to Friday - 8:30 am to 8 pm (AEST),The Personal Property Securities Register (PPSR) is a national online register that can provide information to help protect consumers when they are buying.,https://www.directory.gov.au/enquiry-lines/p#paginationControl
Pharmaceutical Benefits Scheme,1800 020 613,Hours of Operation: Business Hours,General information service,https://www.directory.gov.au/enquiry-lines/p#paginationControl
Prescriber Information,1800 552 580,,,https://www.directory.gov.au/enquiry-lines/p#paginationControl
Privacy Enquiries Line,1300 363 992,,The Office of the Australian Information Commissioner Enquiries Line covers FOI and Privacy enquiries,https://www.directory.gov.au/enquiry-lines/p#paginationControl
Radiation Protection and Nuclear Safety,1800 022 333,,General information service,https://www.directory.gov.au/enquiry-lines/r#paginationControl
Registered Organisations Commission,1300 341 665,Hours of Operation: 9.00am - 5.00pm Monday to Friday,We’re here to educate and support registered organisations in Australia ensure they comply with legislative requirements.,https://www.directory.gov.au/enquiry-lines/r#paginationControl
Rehabilitation Appliances Program (RAP),1800 550 457,,"The Rehabilitation Appliances Program (RAP) Enquiry Line exists to enable ease of access to prescribers, suppliers, clients and internal staff to submit RAP related questions, accounts and requests.",https://www.directory.gov.au/enquiry-lines/r#paginationControl
Reserve Bank of Australia,1800 300 288,,General enquiries,https://www.directory.gov.au/enquiry-lines/r#paginationControl
Responsible for Algeria,0011 +33 1 4059 3300,,Australian Embassy in France,https://www.directory.gov.au/enquiry-lines/r#paginationControl
Royal Australian Mint,1300 652 020,Hours of Operation: 8.30am to 4.30pm,,https://www.directory.gov.au/enquiry-lines/r#paginationControl
Rural Health National Information Line,1800 020 787,Hours of Operation: Business Hours,General Enquiries,https://www.directory.gov.au/enquiry-lines/r#paginationControl
Self-help Business,13 7226,,Lodge yourNIL activity statementNIL annual GST returnGST or PAYG instalment annual electionsRegister for fuel tax creditsMake a payment arrangementEnquire about the progress of your lodgments or your ABN application,https://www.directory.gov.au/enquiry-lines/s#paginationControl
Self-help Individuals,13 2865,,Enquire about the progress of your lodgmentsSearch for your lost superApply for refund of GST creditsMake a payment arrangement,https://www.directory.gov.au/enquiry-lines/s#paginationControl
Self-help Publications,1300 720 092,,"Order publications and forms, including individual tax return instructions and forms",https://www.directory.gov.au/enquiry-lines/s#paginationControl
Senior's Card (Commonwealth),13 2300,,Seniors Card is a FREE discount card providing members with access to Government concessions and business discounts.,https://www.directory.gov.au/enquiry-lines/s#paginationControl
Severe Acute Respiratory Syndrome (SARS),1800 004 599,Hours of Operation: The operating hours 8.30 am - 5.00 pm Monday to Friday. After Hours - recorded message,Information Hotline,https://www.directory.gov.au/enquiry-lines/s#paginationControl
The Translating and Interpreting Service,131 450,"Hours of Operation: 24 hours, every day of the year","The Translating and Interpreting Service (TIS National) is an interpreting service provided by the Department of Home Affairs for people with limited English proficiency and for agencies and businesses that need to communicate with their non-English speaking clients.The TIS National services can be accessed 24 hours a day at the cost of the call for any person who needs an interpreter.Contact details for TIS National services, general enquires or feedback can be found at www.tisnational.gov.au/Contact-us",https://www.directory.gov.au/enquiry-lines/t#paginationControl
Therapeutic Goods Administration,1800 020 653,Hours of Operation: Business Hours,Enquiries,https://www.directory.gov.au/enquiry-lines/t#paginationControl
