service_name,phone_number,hours_of_operation,description,source_url
Tourism Australia,+61 2 9360 1111,"Hours of Operation: During office hours, 9.00 am - 5.30 pm (AEST)",TBA,https://www.directory.gov.au/enquiry-lines/t#paginationControl
Transport Bookings,1300 550 455,Hours of Operation: 8am to 5 pm Monday - Friday,This line allows veterans their representatives and health providers arrange taxi transport to medical appointments under the BCWD scheme.,https://www.directory.gov.au/enquiry-lines/t#paginationControl
Transport Claims,1800 838 372,Hours of Operation: 8am to 5 pm Monday - Friday,This line allows veterans and the representatives to contact Transport staff members to make enquiries regarding the their travel reimbursement eligibility and to check on progress of claims previously lodged.,https://www.directory.gov.au/enquiry-lines/t#paginationControl
Travel Advice - Smartraveller,1300 555 135,Hours of Operation: Emergency consular assistance is available 24 hours,"•   Travel advisories from the Department of Foreign Affairs and Trade we deliver a range ofconsular services for Australians travelling or living overseas. We deliver our servicesthrough Australian embassies, high commissions and consulates overseas.___________________________________________________________________________•   Smartraveller provides official overseas travel advice. Our travel advice aims to inform youof the risks and how to avoid or handle difficulties overseas. Ultimately, though, it’s adviceonly and the decision to travel is yours. It’s also your responsibility to take care of your safetyand wellbeing.___________________________________________________________________________•   If you, or someone you know, needs urgent help or you have significant welfare concerns,emergency consular assistance is available 24 hours a day by calling the ConsularEmergency Centre (CEC) in Canberra on:1300 555 135 (within Australia)+61 2 6261 3305 (from overseas)___________________________________________________________________________Please use link below to contact Smartraveller.https://www.smartraveller.gov.au/about-us/contact-us",https://www.directory.gov.au/enquiry-lines/t#paginationControl
Travel Health,1300 555 135,Hours of Operation: Business hours,Providing advice on Travel Health.,https://www.directory.gov.au/enquiry-lines/t#paginationControl
Treasury (Contact),1800 020 008,Hours of Operation: Business Hours,General Enquiries,https://www.directory.gov.au/enquiry-lines/t#paginationControl
Treatment Card Inquiries,1800 838 372,,Treatment Card Inquiries,https://www.directory.gov.au/enquiry-lines/t#paginationControl
Use of the word Anzac,1800 838 372,,All enquiries around the use of the word Anzac.,https://www.directory.gov.au/enquiry-lines/u#paginationControl
VAPAC,1800 552 580,,The Veterans' Affairs Pharmaceutical Approvals Centre,https://www.directory.gov.au/enquiry-lines/v#paginationControl
Veteran & Community Grants,1800 020 283,,Information on the Veteran and Community Grants (V&CG) Program which  is to maintain and improve the independence and quality of life for members of the Australian veteran community by providing funding for projects that sustain or enhance health and wellbeing.,https://www.directory.gov.au/enquiry-lines/v#paginationControl
Veterans' Home Care Assessment,1300 550 450,,Veterans' Home Care Assessment Agency,https://www.directory.gov.au/enquiry-lines/v#paginationControl
Veterans' Review Board,1300 550 460,,,https://www.directory.gov.au/enquiry-lines/v#paginationControl
War Graves - Individual Commemorations,1800 838 372,,"War Graves, individual commemorations",https://www.directory.gov.au/enquiry-lines/w#paginationControl
Weather Connect,1300 754 389,,Weather Connect,https://www.directory.gov.au/enquiry-lines/w#paginationControl
